{
  "systemIniciator": "transfer-orchestrator",
  "eventType": "ORDER_PROCESSED",
  "operationCode": "9775",
  "senderUnc": "18003277",
  "senderMdmId": "1353423167",
  "transferOrderId": "0eb52d92-d5a3-44a9-9d0a-c2a35508bef8",
  "createdAt": 1652855458,
  "updatedAt": 1652855471.872638784,
  "reasonLaunch": "USER",
  "fields": {
    "documentNumber": "034257",
    "senderName": "Чистяков Сергей Нколаевич",
    "receiverName": "Чистяков Сергей Нколаевич",
    "receiverMdmId": "1353423167",
    "sourceProductId": "EA3B61E6A58A484F932349BDAD29ABBA",
    "targetProductId": "B7587A0E90614E1EA198BFCCD9F13C43",
    "sourceAmount": "1.00",
    "sourceCurrency": "RUB",
    "targetAmount": "1.00",
    "targetCurrency": "RUB",
    "rate": "1",
    "purpose": "Перевод между своими счетами",
    "spmCheckResult": "ALLOW",
    "confirmingData": "[{\"key\":\"fullName\",\"label\":\"Тип перевода\",\"value\":\"Перевод между своими счетами\"},{\"key\":\"sourceAccount\",\"label\":\"Счет списания\",\"value\":\"40817810********2753\"},{\"key\":\"targetAccount\",\"label\":\"Счет зачисления\",\"value\":\"40817810********3328\"},{\"key\":\"sourceSum\",\"label\":\"Сумма\",\"value\":\"1 ?\"},{\"key\":\"commission\",\"label\":\"Сумма комиссии\",\"value\":\"0 ?\"},{\"key\":\"status\",\"label\":\"Статус\",\"value\":\"Выполнено\"}]",
    "sourceAccount": "40817810223004012753",
    "sourceSystem": "PROFILE",
    "sourceSystemClientId": "6300435",
    "targetAccount": "40817810123004013328",
    "targetSystem": "PROFILE",
    "targetSystemClientId": "6300435",
    "commissionAmount": "0",
    "commissionCurrency": "RUB",
    "status": "PROCESSED",
    "sourceProductBranch": "00000",
    "targetProductBranch": "00000",
    "sourceSumRub": "1.00",
    "sourceProductType": "ACCOUNT",
    "targetProductType": "ACCOUNT",
    "interactionChannel": "MOBILE"
  }
}